Name_EN,Address_EN,Latitude,Longitude,Facility_Type
Radio-diagnostic & Imaging Centre (Fanling),"5/F, Fanling Health Centre, 2 Pik Fung Road, Fanling, New Territories",22.49654684,114.13878847,ClinicsHealthCentresundertheDepartmentofHealth
Kowloon Bay Integrated Treatment Centre,"8/F, Kowloon Bay Health Centre, 
9 Kai Yan Street, Kowloon Bay, Hong Kong, China",22.32862653,114.20710074,ClinicsHealthCentresundertheDepartmentofHealth
Lek Yuen Elderly Health Centre,"3/F, Lek Yuen Health Centre 9 Lek Yuen Street Shatin, N.T.",22.38377826,114.19181873,ClinicsHealthCentresundertheDepartmentofHealth
Wan Chai Elderly Health Centre,"2/F, Southorn Centre, 130 Hennessy Road, Wan Chai, Hong Kong",22.27738058,114.17266322,ClinicsHealthCentresundertheDepartmentofHealth
Shau Kei Wan Elderly Health Centre,"G/F, Shau Kei Wan Jockey Club Clinic, 8 Chai Wan Road, Shau Kei Wan, Hong Kong",22.27648746,114.22833908,ClinicsHealthCentresundertheDepartmentofHealth
Tseung Kwan O Elderly Health Centre,"G/F, Tseung Kwan O Jockey Club Clinic, 99 Po Lam Road North, Tseung Kwan O, N.T.",22.32526691,114.25960177,ClinicsHealthCentresundertheDepartmentofHealth
Yau Ma Tei Elderly Health Centre,"1/F, Yau Ma Tei Jockey Club Polyclinic, 145 Battery Street, Yau Ma Tei, Kowloon",22.30961978,114.16926541,ClinicsHealthCentresundertheDepartmentofHealth
Sham Shui Po Methadone Clinic,"137 Yee Kuk Street, Sham Shui Po",22.3266961,114.16166432,ClinicsHealthCentresundertheDepartmentofHealth
Wanchai Chest Clinic,"Wanchai Polyclinic, 99 Kennedy Road, Wan Chai, Hong Kong",22.27367806,114.17488527,ClinicsHealthCentresundertheDepartmentofHealth
Shaukiwan Chest Clinic,"Shaukiwan Jockey Club Polyclinic, 8 Chai Wan Road, Hong Kong",22.27648746,114.22833908,ClinicsHealthCentresundertheDepartmentofHealth
East Kowloon Chest Clinic,"East Kowloon Polyclinic, 160 Hammer Hill Road, Kowloon",22.33976112,114.207705,ClinicsHealthCentresundertheDepartmentofHealth
Tin Shui Wai Maternal & Child Health Centre,"1/F, Tin Shui Wai Health Centre, 3 Tin Shui Road, Tin Shui Wai.",22.45454584,114.00144453,ClinicsHealthCentresundertheDepartmentofHealth
Tsuen Wan Elderly Health Centre,"G/F, Lady Trench Polyclinic, 213 Sha Tsui Road, Tsuen Wan, NT",22.37055568,114.1155394,ClinicsHealthCentresundertheDepartmentofHealth
Kowloon City Elderly Health Centre,"G/F, Lions Clubs Health Centre, 80 Hau Wong Road, Kowloon City, Kowloon",22.33019119,114.18903688,ClinicsHealthCentresundertheDepartmentofHealth
Aberdeen Elderly Health Centre,"G/F, Block B, Aberdeen Jockey Club Clinic, 10 Aberdeen Reservoir Road, Aberdeen, Hong Kong",22.24995324,114.15633695,ClinicsHealthCentresundertheDepartmentofHealth
Yuen Long Elderly Health Centre,"G/F, Madam Yung Fung Shee Health Centre 26 Sai Ching Street, Yuen Long, NT",22.44101701,114.02709778,ClinicsHealthCentresundertheDepartmentofHealth
Nam Shan Elderly Health Centre,"G/F, Nam Yiu House, Nam Shan Estate, Shek Kip Mei, Kowloon",22.33412887,114.17068131,ClinicsHealthCentresundertheDepartmentofHealth
Lam Tin Elderly Health Centre,"G/F, Lam Tin Community Complex,223 Pik Wan Road,Lam Tin, Kowloon",22.30838872,114.23949235,ClinicsHealthCentresundertheDepartmentofHealth
Kwai Shing Elderly Health Centre,"1/F,Shing Wo House, Kwai Shing East Estate, Kwai Yip Street, Kwai Chung, NT",22.36541216,114.12685281,ClinicsHealthCentresundertheDepartmentofHealth
Tang Shiu Kin School Dental Clinic 5/F,"5/F, MacLehose Dental Centre
286 Queen’s Road East, Wanchai, HK",22.27506878,114.17845592,ClinicsHealthCentresundertheDepartmentofHealth
Tang Shiu Kin School Dental Clinic 1/F,"1/F, MacLehose Dental Centre
286 Queen’s Road East, Wanchai, HK",22.27506878,114.17845592,ClinicsHealthCentresundertheDepartmentofHealth
Tang Shiu Kin School Dental Clinic 2/F,"2/F, MacLehose Dental Centre
286 Queen’s Road East, Wanchai, HK",22.27506878,114.17845592,ClinicsHealthCentresundertheDepartmentofHealth
Kowloon Chest Clinic,"147A, Argyle Street, Kowloon",22.32193769,114.17834969,ClinicsHealthCentresundertheDepartmentofHealth
Tai Po Chest Clinic,"1/F,Tai Po Jockey Club Clinic, 37 Ting Kok Road, Tai Po, New Territories",22.45401767,114.1657698,ClinicsHealthCentresundertheDepartmentofHealth
Pneumoconiosis Clinic,"4/F, Shaukeiwan Jockey Club Polyclinic, 8 Chai Wan Road, Hong Kong",22.27648746,114.22833908,ClinicsHealthCentresundertheDepartmentofHealth
Yaumati Chest Clinic,"Yaumati Jockey Club Polyclinic, 145 Battery Street, Kowloon",22.30961978,114.16926541,ClinicsHealthCentresundertheDepartmentofHealth
Radio-diagnostic & Imaging Centre (Kowloon Bay),"10/F, Kowloon Bay Health Centre & Alice Ho Miu Ling Nethersole Nursing Home, 9 Kai Yan Street, Kowloon Bay, Kowloon",22.32862653,114.20710074,ClinicsHealthCentresundertheDepartmentofHealth
South Kwai Chung Chest Clinic,"310 Kwai Shing Circuit, South Kwai Chung, New Territories",22.36103196,114.12562135,ClinicsHealthCentresundertheDepartmentofHealth
Tung Chung Chest Clinic,"1/F, Tung Chung Health Centre, 6 Fu Tung Street, Tung Chung, New Territories",22.28885346,113.94352614,ClinicsHealthCentresundertheDepartmentofHealth
Yan Oi Chest Clinic,"6 Tuen Lee Street, Tuen Mun, New Territories",22.3912257,113.97914039,ClinicsHealthCentresundertheDepartmentofHealth
Sheung Shui Chest Clinic,"Shek Wu Hui Jockey Club Clinic, Jockey Club Road, Sheung Shui, New Territories",22.50530378,114.12924213,ClinicsHealthCentresundertheDepartmentofHealth
Tseung Kwan O Families Clinic,"2/F, Tseung Kwan O Government Offices, North Tower, 30 Tong Yin Street, Tseung Kwan O, Sai Kung",22.30467382,114.25637955,ClinicsHealthCentresundertheDepartmentofHealth
Fanling Maternal & Child Health Centre,"3/F, Fanling Health Centre, 2 Pik Fung Road, Fanling",22.49654684,114.13878847,ClinicsHealthCentresundertheDepartmentofHealth
Tseung Kwan O Government Offices Dental Clinic,"3/F, Tseung Kwan O Government Offices, North Tower, 30 Tong Yin Street, Tseung Kwan O, Sai Kung, N.T.",22.30463427,114.25634529,ClinicsHealthCentresundertheDepartmentofHealth
Kowloon City Lions Clubs Student Health Service Centre,"1/F Lions Clubs Health Centre, 80 Hau Wong Road, Kowloon City",22.33019119,114.18903688,ClinicsHealthCentresundertheDepartmentofHealth
South Kwai Chung Student Health Service Centre,"2/F South Kwai Chung Polyclinic, 310 Kwai Shing Circuit, Kwai Chung, Tsuen Wan",22.36080613,114.12539813,ClinicsHealthCentresundertheDepartmentofHealth
Sha Tin Student Health Service Centre,"1/F Sha Tin (Tai Wai) Clinic, 2 Man Lai Road, Tai Wai, Sha Tin",22.37752063,114.18410832,ClinicsHealthCentresundertheDepartmentofHealth
West Kowloon Government Offices Student Health Service Centre cum Special Assessment Centre,"2/F, South Tower,West Kowloon Government Offices,11 Hoi Ting Road, Yau Ma Tei, Kowloon",22.31241862,114.16365548,ClinicsHealthCentresundertheDepartmentofHealth
Shek Kip Mei Chest Clinic (all services suspended),"Shek Kip Mei Health Centre, 2 Berwick Street, Kowloon",22.33101315,114.16729378,ClinicsHealthCentresundertheDepartmentofHealth
Education and Training Centre in Family Medicine,"2/F, Ngau Tau Kok Jockey Club Clinic, 60 Ting On Street, Ngau Tau Kok, Kowloon",22.31706524,114.21695934,ClinicsHealthCentresundertheDepartmentofHealth
Fanling Families Clinic,"8/F, Fanling Health Centre, 2 Pik Fung Road, Fanling",22.49621128,114.13885044,ClinicsHealthCentresundertheDepartmentofHealth
Chai Wan Families Clinic,"1/F, Main Block, Pamela Youde Nethersole Eastern Hospital, 3 Lok Man Road, Chai Wan",22.26932987,114.23638767,ClinicsHealthCentresundertheDepartmentofHealth
Hong Kong Families Clinic,"3/F, Tang Chi Ngong Specialist Clinic, 284 Queen's Road East, Wan Chai",22.27529393,114.17820167,ClinicsHealthCentresundertheDepartmentofHealth
Kowloon Families Clinic,"6/F, Kowloon City Health Centre 42 Bailey Street, Hung Hom",22.31188455,114.18959843,ClinicsHealthCentresundertheDepartmentofHealth
New Territories Families Clinic,"G/F, Maurine Grantham Health Centre, 115 Castle Peak Road, Tsuen Wan",22.37054633,114.11976082,ClinicsHealthCentresundertheDepartmentofHealth
Hong Kong Integrated Care Centre for Civil Service,"1/F, Central District Health Centre, 1 Kau U Fong, Central",22.28450894,114.1526204,ClinicsHealthCentresundertheDepartmentofHealth
Chai Wan Maternal & Child Health Centre,"Level 2, Government Office, Block 6, New Jade Garden, 233 Chai Wan Road, Chai Wan.",22.26368831,114.23630954,ClinicsHealthCentresundertheDepartmentofHealth
North District Maternal and Child Health Centre,"7/F, North District Community Health Centre Building, No.3 Wai Wo Street, Sheung Shui",22.49837756,114.12761355,ClinicsHealthCentresundertheDepartmentofHealth
North District Elderly Health Centre,"8/F, North District Community Health Centre Building, No. 3 Wai Wo Street, Sheung Shui, N.T.",22.49833441,114.12759616,ClinicsHealthCentresundertheDepartmentofHealth
Ap Lei Chau Maternal & Child Health Centre,"2/F, Ap Lei Chau Clinic, 161 Ap Lei Chau Main Street, Ap Lei Chau.",22.24324308,114.15361202,ClinicsHealthCentresundertheDepartmentofHealth
Wu York Yu Maternal & Child Health Centre,"1/F, Wu York Yu Health Centre, 55 Sheung Fung Street, Wong Tai Sin.",22.34691495,114.19749389,ClinicsHealthCentresundertheDepartmentofHealth
Sai Ying Pun Maternal & Child Health Centre,"4/F, Sai Ying Pun Jockey Club Polyclinic, 134 Queen's Road West, Sai Ying Pun.",22.28643525,114.14503654,ClinicsHealthCentresundertheDepartmentofHealth
North Kwai Chung Maternal & Child Health Centre,"1/F, North Kwai Chung Clinic, 125 Tai Pak Tin Street, Kwai Chung.",22.36985878,114.14031825,ClinicsHealthCentresundertheDepartmentofHealth
Mui Wo Maternal & Child Health Centre,"1/F, Mui Wo Clinic, 2 Ngan Kwong Wan Road, Mui Wo, Lantau Island",22.26611127,113.99797404,ClinicsHealthCentresundertheDepartmentofHealth
East Kowloon Maternal & Child Health Centre,"1/F, East Kowloon Polyclinic, 160 Hammer Hill Road, Diamond Hill",22.33951725,114.20794763,ClinicsHealthCentresundertheDepartmentofHealth
Robert Black Maternal & Child Health Centre,"1/F, Robert Black Health Centre, 600 Prince Edward Road East, San Po Kong",22.33249336,114.19562805,ClinicsHealthCentresundertheDepartmentofHealth
Yaumatei Maternal & Child Health Centre,"1/F, 10 Yan Cheung Road, Yaumatei, Kowloon",22.30916042,114.16658582,ClinicsHealthCentresundertheDepartmentofHealth
Tsing Yi Maternal & Child Health Centre,"3/F, Cheung Hong Commercial Complex Phase I, Cheung Hong Estate, Tsing Yi",22.34891428,114.10593794,ClinicsHealthCentresundertheDepartmentofHealth
Anne Black Maternal & Child Health Centre,"2/F, Anne Black Health Centre, 140 Tsat Tsz Mui Road, North Point.",22.29136664,114.20499663,ClinicsHealthCentresundertheDepartmentofHealth
Cheung Chau Maternal & Child Health Centre,"G/F, Out-patient Department Block, St. John Hospital, Cheung Chau Hospital Road, Cheung Chau",22.2082217,114.03111861,ClinicsHealthCentresundertheDepartmentofHealth
Wang Tau Hom Maternal & Child Health Centre,"G/F, Wang Tau Hom Jockey Club Clinic, 200 Junction Road, Wang Tau Hom",22.33911364,114.18537799,ClinicsHealthCentresundertheDepartmentofHealth
South Kwai Chung Maternal & Child Health Centre,"1/F, South Kwai Chung Jockey Club Polyclinic, 310 Kwai Shing Circuit, Kwai Chung.",22.36080613,114.12539813,ClinicsHealthCentresundertheDepartmentofHealth
Kwai Chung Hospital Dental Clinic,"1/F, Kwai Chung Hospital Day Recovery Centre, 3 - 15 Kwai Chung Hospital Road, Kwai Chung, NT",22.3419526,114.13425831,ClinicsHealthCentresundertheDepartmentofHealth
North District Student Health Service Centre,"9/F North District Community Health Centre Building, 3 Wai Wo Street, Sheung Shui, New Territories",22.49847461,114.12755258,ClinicsHealthCentresundertheDepartmentofHealth
Yuen Long Student Health Service Centre,"1/F Yuen Long Jockey Club Health Centre, 269 Castle Peak Road, Yuen Long",22.44560048,114.02316812,ClinicsHealthCentresundertheDepartmentofHealth
Lady Trench Methadone Clinic,"213 Sha Tsui Road, Tsuen Wan",22.37055568,114.1155394,ClinicsHealthCentresundertheDepartmentofHealth
Yuen Long Government Offices Dental Clinic,"1F, Yuen Long Government Offices,2 Kiu Lok Square,Yuen Long, New Territories",22.44526695,114.0272183,ClinicsHealthCentresundertheDepartmentofHealth
Tuen Mun Wu Hong Elderly Health Centre,"G/F Tuen Mun Wu Hong Health Centre, 2 Wu Hong Street, Tuen Mun, NT",22.37715012,113.96712969,ClinicsHealthCentresundertheDepartmentofHealth
Yuen Chau Kok Chest Clinic,"29 Chap Wai Kon Street, Sha Tin, New Territories",22.38247667,114.20150951,ClinicsHealthCentresundertheDepartmentofHealth
Pamela Youde Child Assessment Centre (Shatin),"2/F, 31-33 Chap Wai Kon Street, Sha Tin, N.T.",22.3817632,114.20187837,ClinicsHealthCentresundertheDepartmentofHealth
Pamela Youde School Dental Clinic,"1/F, 31-33, Chap Wai Kon Street,Yuen Chau Kok, Shatin, NT",22.3817632,114.20187837,ClinicsHealthCentresundertheDepartmentofHealth
Cheung Chau Methadone Clinic,"1/F, Out-patient Department Block, St. John Hospital, Cheung Chau Hospital Road, Tung Wan, Cheung Chau",22.20822141,114.0311186,ClinicsHealthCentresundertheDepartmentofHealth
Yau Ma Tei Methadone Clinic,"145 Battery Street, Yau Ma Tei",22.30967269,114.16928035,ClinicsHealthCentresundertheDepartmentofHealth
Cheung Chau Dental Clinic,"2/F, Out-patient Department Block, St. John Hospital,Cheung Chau Hospital Road,Tung Wan, Cheung Chau",22.2082217,114.03111861,ClinicsHealthCentresundertheDepartmentofHealth
Cheung Chau Chest Clinic,"G/F, Out-patient Department Block, St. John Hospital, Cheung Chau Hospital Road, Tung Wan, Cheung Chau, New Territories",22.2082217,114.03111861,ClinicsHealthCentresundertheDepartmentofHealth
Ngau Tau Kok Child Assessment Centre,"1/F, Ngau Tau Kok Jockey Club Clinic, 60 Ting On Street, Ngau Tau Kok, Kln.",22.31705197,114.2169533,ClinicsHealthCentresundertheDepartmentofHealth
Pamela Youde Child Assessment Centre (Kwun Tong),"3/F, 79 Cha Kwo Ling Road, Kwun Tong, Kowloon.",22.30773324,114.22886491,ClinicsHealthCentresundertheDepartmentofHealth
Fanling Child Assessment Centre,"4/F, Fanling Health Centre, 2 Pik Fung Road, Fanling, N.T.",22.49654684,114.13878847,ClinicsHealthCentresundertheDepartmentofHealth
Ha Kwai Chung Child Assessment Centre,"2/F, Ha Kwai Chung Polyclinic & Special Education Services Centre, 77 Lai Cho Road, Kwai Chung, N.T.",22.35242659,114.12801273,ClinicsHealthCentresundertheDepartmentofHealth
Central Kowloon Child Asessment Centre,"2/F, 147L Argyle Street, Kowloon City, Kowloon.",22.32543238,114.1839212,ClinicsHealthCentresundertheDepartmentofHealth
Tuen Mun Child Assessment Centre,"G/F, Special Block, Tuen Mun Hospital, Tsing Chung Koon Road, Tuen Mun, N.T.",22.40827229,113.97675625,ClinicsHealthCentresundertheDepartmentofHealth
Yuen Long Chest Clinic,"G/F, Yuen Long Jockey Club Health Centre, 269 Castle Peak Road-Yuen Long, Yuen Long, New Territories",22.44560077,114.02316812,ClinicsHealthCentresundertheDepartmentofHealth
West Kowloon Government Offices Dental Clinic,"2/F, South Tower, West Kowloon Government Offices, 11 Hoi Ting Road, Yau Ma Tei, Kowloon",22.31241862,114.16365548,ClinicsHealthCentresundertheDepartmentofHealth
Yuen Long Jockey Club Dental Clinic,"269 Castle Peak Road – Yuen Long, Yuen Long, N.T.",22.44560077,114.02316812,ClinicsHealthCentresundertheDepartmentofHealth
Yuen Long Methadone Clinic,"269 Castle Peak Road - Yuen Long, Yuen Long",22.44560077,114.02316812,ClinicsHealthCentresundertheDepartmentofHealth
Yau Ma Tei Dermatological Clinic,"9/F, Yau Ma Tei Jockey Club Polyclinic, 145 Battery Street, Yau Ma Tei, Kowloon.",22.30961949,114.1692654,ClinicsHealthCentresundertheDepartmentofHealth
Tang Shiu Kin Dental Clinic,"G/F, 140 Tsat Tsz Mui Road, North Point, Hong Kong",22.29137074,114.20486106,ClinicsHealthCentresundertheDepartmentofHealth
Western Dental Clinic,"G/F, 50 Pokfulam Road, Sai Ying Pun, Hong Kong",22.28527785,114.13948633,ClinicsHealthCentresundertheDepartmentofHealth
Pamela Youde Government Dental Clinic,"1/F, 31-33 Chap Wai Kon Street, Yuen Chau Kok, Sha Tin, New Territories",22.38193446,114.20204347,ClinicsHealthCentresundertheDepartmentofHealth
MacLehose Dental Centre 2/F,"2/F , MacLehose Dental Centre, 286 Queen's Road East, Wanchai, Hong Kong",22.27523104,114.17849473,ClinicsHealthCentresundertheDepartmentofHealth
MacLehose Dental Centre 6/F,"6/F , MacLehose Dental Centre, 286 Queen's Road East, Wanchai, Hong Kong",22.27521298,114.17851413,ClinicsHealthCentresundertheDepartmentofHealth
Queensway Government Offices Dental Clinic,"4/F, Lower Block, Queensway Government Offices, 66 Queensway, Hong Kong",22.27802102,114.16416327,ClinicsHealthCentresundertheDepartmentofHealth
Victoria Road Dental Clinic,"2/F Kennedy Town Jockey Club Clinic, 45 Victoria Road, Hong Kong",22.28182383,114.12395215,ClinicsHealthCentresundertheDepartmentofHealth
Sai Ying Pun Dental Clinic 8/F,"8/F, Sai Ying Pun Jockey Club Polyclinic, 134 Queen's Road West, Sai Ying Pun, Hong Kong",22.28633036,114.14512915,ClinicsHealthCentresundertheDepartmentofHealth
Sai Ying Pun Dental Clinic 3/F,"3/F, Sai Ying Pun Jockey Club Polyclinic, 134 Queen's Road West, Sai Ying Pun, Hong Kong",22.28633034,114.14512411,ClinicsHealthCentresundertheDepartmentofHealth
Tseung Kwan O Dental Clinic,"2/F, Tseung Kwan O Po Ning Road Health Centre, 28 Po Ning Road, Tseung Kwan O, N.T.",22.31781544,114.26790863,ClinicsHealthCentresundertheDepartmentofHealth
Hong Kong Police College Dental Clinic,"Hong Kong Police College, 18 Ocean Park Road, Wong Chuk Hang, HK",22.24727063,114.17165679,ClinicsHealthCentresundertheDepartmentofHealth
Harbour Building Dental Clinic,"9/F Harbour Building, 38 Pier Road, Hong Kong",22.28656915,114.15497964,ClinicsHealthCentresundertheDepartmentofHealth
Yau Ma Tei Orthodontic Clinic,"6/F, Yau ma tei Jockey Club Polyclinic, 145 Battery Street, Kowloon",22.309567,114.16921312,ClinicsHealthCentresundertheDepartmentofHealth
Harbour Building Orthodontic Clinic,"9/F Harbour Building, 38 Pier Road, Central District, HK",22.28658533,114.15502745,ClinicsHealthCentresundertheDepartmentofHealth
Ma On Shan Dental Clinic,"1/F, Ma On Shan Health Centre, 609 Sai Sha Road, Ma On Shan, New Territories",22.42508276,114.23490163,ClinicsHealthCentresundertheDepartmentofHealth
Ha Kwai Chung Government Dental Clinic,"1/F, Ha Kwai Chung Polyclinic 77 Lai Cho Road, Kwai Chung, New Territories",22.35240466,114.12804814,ClinicsHealthCentresundertheDepartmentofHealth
Wan Chai Dental Clinic,"2/F, 99 Kennedy Road Wan Chai, Hong Kong",22.27371018,114.17486,ClinicsHealthCentresundertheDepartmentofHealth
Madam Yung Fung Shee Dental Clinic,"2/F, Madam Yung Fung Shee Health Centre, 26 Sai Ching Street, Yuen Long, New Territories",22.44102824,114.02708501,ClinicsHealthCentresundertheDepartmentofHealth
Tung Chung Dental Clinic,"G/F, Tung Chung Health Centre, 6 Fu Tung Street, Tung Chung, New Territories",22.28856361,113.94312876,ClinicsHealthCentresundertheDepartmentofHealth
Tsuen Wan Government Offices Dental Clinic,"14/F, Tsuen Wan Government Offices, 38 Sai Lau Kok Road, Tsuen Wan, New Territories",22.37471498,114.11497039,ClinicsHealthCentresundertheDepartmentofHealth
Sheung Kwai Chung Prosthodontic Clinic,"1/F, Mrs. Wu York Yu Health Centre, 310 Wo Yi Hop Road,Lei Muk Shue, N.T",22.37619507,114.13670267,ClinicsHealthCentresundertheDepartmentofHealth
Sheung Kwai Chung Government Dental Clinic,"2/F, Mrs. Wu York Yu Health Centre, 310, Wo Yi Hop Road, Lei Muk Shue, N.T",22.37625696,114.13670685,ClinicsHealthCentresundertheDepartmentofHealth
Li Po Chun Dental Clinic,"2/F Li Po Chun Health Centre, 22 Arran Street, Tai Kwok Tsui, Kowloon",22.32274832,114.16609068,ClinicsHealthCentresundertheDepartmentofHealth
Yau Ma Tei Dental Clinic,"5/F, Yau Ma Tei Jockey Club Polyclinic,145 Battery Street, Yau Ma Tei, Kowloon",22.3095471,114.16924275,ClinicsHealthCentresundertheDepartmentofHealth
Kwun Tong Yung Fung Shee Dental Clinic,"G/F, Yung Fung Shee Memorial Centre,79 Cha KwoLing Road,Kwun Tong,Kowloon",22.3079338,114.22881931,ClinicsHealthCentresundertheDepartmentofHealth
Cheung Sha Wan Government Offices Dental Clinic,"3/F, West Kowloon Health Centre, Cheung Sha Wan Government Offices, 303 Cheung Sha Wan Road, Sham Shui Po, Kowloon",22.33167207,114.16024315,ClinicsHealthCentresundertheDepartmentofHealth
Castle Peak Hospital Dental Clinic,"15 Tsing Chung Koon Road, Tuen Mun, New Territories",22.40952964,113.97148073,ClinicsHealthCentresundertheDepartmentofHealth
Chai Wan Government Dental Clinic,"1/F, Main Block, Pamela Youde Nethersole Eastern Hospital",22.26955629,114.23633152,ClinicsHealthCentresundertheDepartmentofHealth
Aberdeen Jockey Club Dental Clinic,"Basement, 10 Aberdeen Reservoir Road, Aberdeen, Hong Kong",22.24995295,114.15633694,ClinicsHealthCentresundertheDepartmentofHealth
San Po Kong Elderly Health Centre,"2/F, Robert Black Health Centre, 600 Prince Edward Road East, San Po Kong, Kowloon",22.33249306,114.19562804,ClinicsHealthCentresundertheDepartmentofHealth
Wong Siu Ching Maternal & Child Health Centre,"1/F, Wong Siu Ching Clinic, 1 Po Wu Lane, Tai Po.",22.45016181,114.16808228,ClinicsHealthCentresundertheDepartmentofHealth
Sai Wan Ho Maternal & Child Health Centre,"2/F, Sai Wan Ho Health Centre, 28 Tai Hong Street, Sai Wan Ho.",22.28458931,114.22382019,ClinicsHealthCentresundertheDepartmentofHealth
Yung Fung Shee Chest Clinic,"Yung Fung Shee Memorial Centre, 79 Cha Kwo Ling Road, Kowloon",22.30773324,114.22886491,ClinicsHealthCentresundertheDepartmentofHealth
Wu York Yu Methadone Clinic,"55 Sheung Fung Street, Tze Wan Shan",22.34691495,114.19749389,ClinicsHealthCentresundertheDepartmentofHealth
Kowloon City Maternal & Child Health Centre,"4/F Kowloon City Health Centre,Kowloon City Government Offices,42 Bailey Street, Hung Hom, Kowloon",22.31194663,114.189737,ClinicsHealthCentresundertheDepartmentofHealth
Tsuen Wan Maternal & Child Health Centre,"9/F, Block C, Yan Chai Hospital, 7–11 Yan Chai Street, Tsuen Wan",22.36994304,114.119472,ClinicsHealthCentresundertheDepartmentofHealth
Kwun Tong Methadone Clinic,"463 Kwun Tong Road, Kwun Tong",22.31246697,114.226351,ClinicsHealthCentresundertheDepartmentofHealth
Ho Man Tin Methadone Clinic,"50 Princess Margaret Road, Ho Man Tin",22.31606781,114.17734994,ClinicsHealthCentresundertheDepartmentofHealth
Kwun Tong Maternal & Child Health Centre,"LG Floor, Kwun Tong Community Health Centre Building, 60 Hip Wo Street, Kwun Tong, Kowloon",22.31491345,114.22604322,ClinicsHealthCentresundertheDepartmentofHealth
Tung Chung Maternal & Child Health Centre,"G/F, Tung Chung Health Centre, 6 Fu Tung Street, Tung Chung, Lantau Island.",22.28885346,113.94352614,ClinicsHealthCentresundertheDepartmentofHealth
Kwun Tong Dental Clinic,"LG/F, Kwun Tong Community Health Centre Building, 60 Hip Woo Street, Kwun Tong, Kowloon",22.31488634,114.22610145,ClinicsHealthCentresundertheDepartmentofHealth
Chai Wan Special Assessment Centre,"3/F Chai Wan Health Centre, 1 Hong Man Street, Chai Wan",22.2652965,114.23426305,ClinicsHealthCentresundertheDepartmentofHealth
Chai Wan Student Health Service Centre,"1/F Chai Wan Health Centre, 1 Hong Man Street, Chai Wan",22.2652965,114.23426305,ClinicsHealthCentresundertheDepartmentofHealth
Tung Chung Elderly Health Centre,"1/F, Block 2, Tung Chung Health Centre, 6 Fu Tung Street, Tung Chung, Lantau Island",22.28885346,113.94352614,ClinicsHealthCentresundertheDepartmentofHealth
Kowloon City Dental Clinic,"3/F, Kowloon City Health Centre, Kowloon City Government Offices, 42 Bailey Street, Hung Hom, Kowloon",22.3118771,114.18972437,ClinicsHealthCentresundertheDepartmentofHealth
Wan Chai Female Social Hygiene Clinic,"7/F, Tang Chi Ngong Specialist Clinic, 284 Queen's Road East, Wan Chai, Hong Kong",22.27524036,114.17818424,ClinicsHealthCentresundertheDepartmentofHealth
Ma On Shan Maternal & Child Health Centre,"1/F, Ma On Shan Health Centre, 609 Sai Sha Road, Ma On Shan.",22.42507401,114.23494048,ClinicsHealthCentresundertheDepartmentofHealth
Tang Chi Ngong Maternal & Child Health Centre,"4/F, Tang Chi Ngong Specialist Clinic, 284 Queen's Road East, Wan Chai.",22.27524036,114.17818424,ClinicsHealthCentresundertheDepartmentofHealth
Wan Chai Female Social Hygiene Clinic (Dermatological Service),"7/F, Tang Chi Ngong Specialist Clinic, 284 Queen's Road East, Wan Chai, Hong Kong",22.27524036,114.17818424,ClinicsHealthCentresundertheDepartmentofHealth
Wan Chai Male Social Hygiene Clinic,"6/F, Tang Chi Ngong Specialist Clinic, 284 Queen's Road East, Wan Chai, Hong Kong",22.27524036,114.17818424,ClinicsHealthCentresundertheDepartmentofHealth
Wan Chai Male Social Hygiene Clinic (Dermatological Service),"6/F, Tang Chi Ngong Specialist Clinic, 284 Queen's Road East, Wan Chai, Hong Kong",22.27524036,114.17818424,ClinicsHealthCentresundertheDepartmentofHealth
Yau Ma Tei Female Social Hygiene Clinic,"3/F, Yau Ma Tei Jockey Club Polyclinic, 145 Battery Street, Yau Ma Tei, Kowloon",22.30961978,114.16926541,ClinicsHealthCentresundertheDepartmentofHealth
Yau Ma Tei Male Social Hygiene Clinic,"4/F, Yau Ma Tei Jockey Club Polyclinic, 145 Battery Street, Yau Ma Tei, Kowloon",22.30961978,114.16926541,ClinicsHealthCentresundertheDepartmentofHealth
Sai Ying Pun Dermatological Clinic,"3/F, Sai Ying Pun Jockey Club Polyclinic, 134 Queen's Road West, Sai Ying Pun, Hong Kong",22.28643525,114.14503654,ClinicsHealthCentresundertheDepartmentofHealth
Chai Wan Social Hygiene Clinic (Male),"West Wing, LG5, Specialist Out-patient Block, Pamela Youde Nethersole Eastern Hospital, 3 Lok Man Road, Chai Wan, Hong Kong",22.26906114,114.23741789,ClinicsHealthCentresundertheDepartmentofHealth
Chai Wan Social Hygiene Clinic,"West Wing, LG5, Specialist Out-patient Block, Pamela Youde Nethersole Eastern Hospital, 3 Lok Man Road, Chai Wan, Hong Kong",22.26906114,114.23741789,ClinicsHealthCentresundertheDepartmentofHealth
Fanling Integrated Treatment Centre (Social Hygiene Service)(Male),"6/F, Fanling Health Centre, 2 Pik Fung Road, Fanling, New Territories",22.49654684,114.13878847,ClinicsHealthCentresundertheDepartmentofHealth
