Name_EN,Address_EN,Latitude,Longitude,Facility_Type
Assemblies of God Medical Clinic,"No. 11-12, G/F, Suet Fung House, Fung Tak Estate, Diamond Hill, Kowloon",22.34469799,114.1998747,ClinicsregisteredunderCap343
Black Point Power Station Health Centre,"Black Point Power Station Health Centre, G/F, Administrative Building, Black Point Power Station, Yung Long Road, Lung Kwu Tan, Tuen Mun, New Territories",22.41322753,113.910776,ClinicsregisteredunderCap343
BOCHK Health Care Division,"Room 1460, Bank of China Tower, 1 Garden Road, Central, Hong Kong",22.2795501,114.1614814,ClinicsregisteredunderCap343
Castle Peak Power Station Health Centre,"Castle Peak Power Station Health Centre, G/F, CPB Control Block, Castle Peak Power Station, Lung Yiu Street, Tuen Mun, New Territories",22.37501945,113.9194888,ClinicsregisteredunderCap343
Centre of Wellness,"Unit Nos. 3 and 5, 21/F, Ocean Building, 80 Shanghai Street, Kowloon",22.3051675,114.1693728,ClinicsregisteredunderCap343
Chai Fat Clinic,"1/F, 33 Fung Tak Road, Wong Tai Sin, Kowloon",22.34364322,114.1967635,ClinicsregisteredunderCap343
Chee Kwong Free Clinic,"297 Pai Tau Village, Sha Tin, New Territories",22.38240952,114.1861518,ClinicsregisteredunderCap343
Christian Family Service Centre Medical Clinic,"Room A, G/F, 3 Tsui Ping Road, Kwun Tong, Kowloon",22.31192069,114.2290135,ClinicsregisteredunderCap343
Clinic of China Resources Company,"Clinic of China Resources Company, D/F, Causeway Centre, 28 Harbour Road, Wan Chai, Hong Kong",22.28053795,114.1763253,ClinicsregisteredunderCap343
Emmanuel Medical Mission,"Medical Room, 1/F, 40 Shing Tak Street, Kowloon City, Kowloon",22.3245696,114.1881165,ClinicsregisteredunderCap343
HAECO Medical Clinic (Chek Lap Kok),"HAECO Medical Clinic (Chek Lap Kok), 3/F, West Annex, Hangar 2, 80 South Perimeter Road, Hong Kong International Airport, Lantau, Hong Kong",22.30372648,113.8996568,ClinicsregisteredunderCap343
Haven of Hope King Lam Clinic,"Western Clinic, Shop No. 3, G/F, King Lui House, King Lam Estate, Tseung Kwan O, New Territories",22.31909749,114.2620134,ClinicsregisteredunderCap343
Haven of Hope S K Yee Hang Hau Clinic,"Western Clinic, G/F, 8 Pui Shing Lane, Tseung Kwan O, New Territories",22.31652719,114.2674293,ClinicsregisteredunderCap343
Haven of Hope S K Yee Hau Tak Clinic,"Western Clinic, Shop No. W017A, Ground Floor, West Wing of TKO Gateway, Hau Tak Estate, Sheung Ning Road, Tseung Kwan O, Sai Kung, New Territories, Hong Kong",22.31760721,114.2645829,ClinicsregisteredunderCap343
Haven of Hope S K Yee Po Lam Clinic,"Western Clinic, Unit 327-328, Po Ning House, Po Lam Estate, Tseung Kwan O, New Territories",22.32556382,114.2554465,ClinicsregisteredunderCap343
Haven of Hope Sau Mau Ping Clinic,"Western Clinic, Shop No. 314, Sau Mau Ping Shopping Centre, Sau Mau Ping Estate, Kowloon",22.31995471,114.2322982,ClinicsregisteredunderCap343
HKFTU Medical & Healthcare Centre (Central Clinic),"X-ray Laboratory & Western Medicine Clinic, Flat A, B & C, 3/F, Siu Ying Commercial Building, 151-155 Queen's Road Central, Hong Kong",22.28486739,114.1537081,ClinicsregisteredunderCap343
HKFTU Medical & Healthcare Centre (Wan Chai Clinic),"13/F, Kwan Chart Tower, 6 Tonnochy Road, Wan Chai, Hong Kong",22.27930012,114.1780978,ClinicsregisteredunderCap343
HKFTU Specialist Medical Centre,"11/F, Silver Commercial Building, 719 Nathan Road, Mongkok, Kowloon",22.32104622,114.1688507,ClinicsregisteredunderCap343
Holistic Wellness Medical Centre,"Unit 01B, 23/F, Crocodile Centre, 79 Hoi Yuen Road, Kwun Tong, Kowloon",22.31175723,114.2255827,ClinicsregisteredunderCap343
Hong Kong Breast Cancer Foundation Breast Health Centre,"21/F, Jupiter Tower, 9 Jupiter Street, North Point, Hong Kong",22.2863358,114.1923621,ClinicsregisteredunderCap343
Hong Kong Breast Cancer Foundation Breast Health Centre (Kowloon),"G/F & 1/F (Portion), 28 Lung Cheung Road, Kowloon",22.33708929,114.2071762,ClinicsregisteredunderCap343
Hong Kong Chiu Chow Merchants Mutual Assistance Society Clinic,"Flat C, 2/F, Gold Union Commercial Building, 70-72 Connaught Road West, Hong Kong",22.28843646,114.146737,ClinicsregisteredunderCap343
"Hong Kong Christian Service, Medical & Dental Clinic","Room 100, Room 105-108, Room 115-120, 1/F, 33 Granville Road, Tsim Sha Tsui, Kowloon",22.30038259,114.1743165,ClinicsregisteredunderCap343
Hong Kong Federation of Trade Unions Workers' Medical Clinics (Kwun Tong Branch),"Western Medicine Clinic, Shop B, G/F, Lai Yue Building, 3 Horse Shoe Lane, Kwun Tong, Kowloon",22.31462879,114.2220246,ClinicsregisteredunderCap343
Hong Kong Federation of Trade Unions Workers' Medical Clinics (Mongkok Branch),"Western Medicine Clinic, 1/F, Silver Commercial Building, 719 Nathan Road, Mongkok, Kowloon",22.32119141,114.1688271,ClinicsregisteredunderCap343
Hong Kong Federation of Trade Unions Workers' Medical Clinics (Tai Po Branch),"Western Medicine Clinic, 1/F, Po Hong Mansion, 70-78 Kwong Fuk Road, Tai Po, New Territories",22.44863815,114.1667293,ClinicsregisteredunderCap343
Hong Kong Federation of Trade Unions Workers' Medical Clinics (Tsuen Wan Branch),"Western Medicine Clinic, Unit A2, B1, B2 & D, G/F, Fou Wah Centre, 210 Castle Peak Road, Tsuen Wan, New Territories",22.3729527,114.1182303,ClinicsregisteredunderCap343
Hong Kong Federation of Trade Unions Workers' Medical Clinics (Tuen Mun Branch),"Western Medicine Clinic, Shop No. 63, G/F, Eldo Court, 132 Heung Sze Wui Road, Tuen Mun, New Territories",22.39829623,113.9755288,ClinicsregisteredunderCap343
Hong Kong Red Swastika Society Free Clinic,"Western Clinic, G/F, No. 25 Dragon Road, Causeway Bay, Hong Kong",22.28224023,114.1930204,ClinicsregisteredunderCap343
Hong Kong Sports Institute Clinic,"Hong Kong Sports Institute Clinic, Level 2, New Facilities Building, Hong Kong Sports Institute, 25 Yuen Wo Road, Sha Tin, New Territories",22.39278038,114.1998512,ClinicsregisteredunderCap343
Hong Kong Workers' Health Centre,"Room 1429 - 1437, 14/F, Beverley Commercial Centre, 87-105 Chatham Road South, Tsim Sha Tsui, Kowloon",22.30144529,114.1759917,ClinicsregisteredunderCap343
Kiangsu Chekiang and Shanghai Medical Centre,"Room 1-7, 1/F, Max Share Centre, 367-373 King's Road, North Point, Hong Kong",22.29110375,114.1979186,ClinicsregisteredunderCap343
Kwun Tong Tsui Ping Road Estate Kaifong Welfare Association Registered Doctor Clinic,"L9, G/F, Tsui Nam House, Tsui Ping (North) Estate, Kwun Tong, Kowloon",22.31682142,114.228824,ClinicsregisteredunderCap343
Lok Sin Tong Chan Kwong Hing Memorial Primary Health Centre,"Western Clinic, G/F, 48 Junction Road, Kowloon City, Kowloon",22.329537,114.1871628,ClinicsregisteredunderCap343
Lok Sin Tong Mr. & Mrs. Lee Yin Yee Medical Centre,"Western Clinic, Flat B, 1211-1215, Pioneer Centre, No. 750 Nathan Road, Prince Edward, Kowloon",22.32271842,114.1690801,ClinicsregisteredunderCap343
Lung Hing Tong Clinic,"Medical Clinic, G/F, 94 Ki Lung Street, Sham Shui Po, Kowloon",22.32676248,114.1651652,ClinicsregisteredunderCap343
PCHK Medical Services Eye Clinic,"Eye Clinic, 2/F, Tsz Wan Shan (South) Estate Community Centre, 45 Wan Wah Street, Wong Tai Sin, Kowloon",22.34653358,114.1994507,ClinicsregisteredunderCap343
Pentecostal Holiness Church Fung Tak Medical Centre,"Medical Clinic, Room 247-254, Ngan Fung House, Fung Tak Estate, Diamond Hill, Kowloon",22.34398611,114.2007016,ClinicsregisteredunderCap343
Po Leung Kuk Cheerful Court Integrated Health Centre,"Consultation Room 1 & 2, dispensary and waiting area of 1/F, Cheerful Court, 55 Choi Ha Road, Ngau Tau Kok, Kowloon",22.32568757,114.216272,ClinicsregisteredunderCap343
Po Leung Kuk Making Life Beautiful Integrated Health Centre,"Room 3, clinic assistants’ working area and clients’ waiting area of Room 1007-1008, 10/F, Hang Seng North Point Building, 341 King’s Road, North Point, Hong Kong",22.29087676,114.1970431,ClinicsregisteredunderCap343
SARDA Wanchai Clinic,"15/F, Southorn Centre, 130 Hennessy Road, Wan Chai, Hong Kong",22.27808819,114.1695918,ClinicsregisteredunderCap343
Sham Shui Po District Council Po Leung Kuk Shek Kip Mei Community Services Centre (Medical Services),"Room 1, 6, 8 and waiting area of Shop No. 101, Mei Kwai House, Shek Kip Mei Estate, 13 Pak Tin Street, Shamshuipo, Kowloon",22.33367233,114.1639303,ClinicsregisteredunderCap343
Sik Sik Yuen Clinic,"General Clinic, C, G/F, Sik Sik Yuen Social Services Complex, 38 Fung Tak Road, Wong Tai Sin, Kowloon",22.34321238,114.1973583,ClinicsregisteredunderCap343
The Family Planning Association of Hong Kong – Kwai Fong Youth Health Care Centre,"Unit 702-705, Level 7, Metroplaza Tower 2, 223 Hing Fong Road, Kwai Fong, New Territories",22.35763051,114.1263679,ClinicsregisteredunderCap343
The Family Planning Association of Hong Kong – Ma Tau Chung Clinic,"1/F & 2/F, 105 Ma Tau Chung Road, Kowloon",22.32435488,114.18834,ClinicsregisteredunderCap343
The Family Planning Association of Hong Kong – Tsuen Wan Clinic,"Room 1621-1622, 16/F, Nan Fung Centre, 264-298 Castle Peak Road, Tsuen Wan, New Territories",22.37403949,114.1163447,ClinicsregisteredunderCap343
The Family Planning Association of Hong Kong – Wan Chai Clinic,"G/F, 8/F & 9/F (Sexual & Reproductive Health Centre), Southorn Centre, 130 Hennessy Road, Wan Chai, Hong Kong",22.27743849,114.173116,ClinicsregisteredunderCap343
The Family Planning Association of Hong Kong – Wong Tai Sin Clinic,"G/F, 1-2 Lung On House, Lower Wong Tai Sin Estate II, Kowloon",22.3415037,114.193012,ClinicsregisteredunderCap343
The Family Planning Association of Hong Kong – Youth Health Care Centre – Mongkok Centre,"Room A, 13/F, Full Win Commercial Centre, 573 Nathan Road, Kowloon",22.31507107,114.1701119,ClinicsregisteredunderCap343
The Family Planning Association of Hong Kong – Yuen Long Clinic,"Unit 5-6, 3/F, Tower 1, One North, 8 Hong Yip Street, Yuen Long, New Territories",22.45081514,114.0297939,ClinicsregisteredunderCap343
The Hong Kong and China Gas Company Limited Clinic,"11/F, 363 Java Road, North Point, Hong Kong",22.29154178,114.2096003,ClinicsregisteredunderCap343
The Islamic Union Medical Clinic,"7/F, 40 Oi Kwan Road, Wan Chai, Hong Kong",22.27765429,114.1787839,ClinicsregisteredunderCap343
TWGHs Integrated Diagnostic and Medical Centre,"TWGHs Integrated Diagnostic and Medical Centre, 5/F, TWGHs Tsui Tsin Tong Outpatient Building, Kwong Wah Hospital, 25 Waterloo Road, Kowloon",22.31558278,114.1717904,ClinicsregisteredunderCap343
TWGHs K B Tam & W K Li Medical Centre (North Point),"Flat B, 11/F, China United Centre, 28 Marble Road, North Point, Hong Kong",22.29172492,114.2005723,ClinicsregisteredunderCap343
UCN – Bradbury Kwong Tin Community Health Centre,"Area A, Unit 203, Kwong Tin Shopping Centre, Kwong Tin Estate, Lam Tin, Kowloon",22.30299514,114.2399593,ClinicsregisteredunderCap343
UCN – Jockey Club Tin Shui Wai Community Health Centre,"Area A, Unit 103, 1/F, Tin Ching Amenity and Community Building, Tin Ching Estate, Tin Shui Wai, New Territories",22.46356843,114.0045482,ClinicsregisteredunderCap343
UCN – Jockey Club Wo Lok Community Health Centre,"Area A, Unit 24, 26-33 & 35, G/F & LG/F, Kui On House, Wo Lok Estate, Hip Wo Street, Kwun Tong, Kowloon",22.31652812,114.2280118,ClinicsregisteredunderCap343
UCN – Kwong Fuk Community Health Centre,"Unit A, Unit 19, G/F, Kwong Yan House, Kwong Fuk Estate, Tai Po, New Territories",22.44867297,114.1752106,ClinicsregisteredunderCap343
UCN Jordan Health Centre,"13/F, Sino Cheer Plaza, 23 Jordan Road, Kowloon",22.30577009,114.1708036,ClinicsregisteredunderCap343
"University Health Service, The Hong Kong Polytechnic University","University Health Service, The Hong Kong Polytechnic University, G/F and 1/F (A125h, A125i, A125j), 1 Yuk Choi Road, Hung Hom, Kowloon",22.30343399,114.1777221,ClinicsregisteredunderCap343
"Clinic of the Association of the Natives of Tung Koon, Shatin","1/F, 6 Portland Street, Kowloon",22.31206989,114.1703574,ClinicsregisteredunderCap343
On On Clinic,"G/F, 30 Shung Wah Street, Fung Wong Village, Kowloon",22.34624883,114.1981517,ClinicsregisteredunderCap343
Po Chai Church Clinic,"G/F, 75 First Street, Sai Ying Pun, Hong Kong",22.28664863,114.1420045,ClinicsregisteredunderCap343
Wood Man Church Clinic,"Flat B, 1/F, Hong Ning Mansion, 56-58 Nga Tsin Wai Road, Kowloon",22.32907652,114.1906922,ClinicsregisteredunderCap343
